"title	",author,content
"大数据产业迎政策暖风 最新大数据概念股一览	",财经热点八客,"""记者昨日从工业和信息化部获悉，《大数据产业“十三五”发展规划》目前已征求了专家意见，并进行了集中讨论和修改，有望在年内发布。"
"Google发布机器学习平台Tensorflow游乐场~带你一起玩神经网络	",硅谷周边,Google发布了Tensorflow游乐场。Tensorflow是Google今年推出的机器学习开源平台。而有了Tensorflow游乐场，我们在浏览器中就可以训练自己的神经网络，还有酷酷的图像让我们更直观地了解神经网络的工作原理。今天，就让硅谷周边带你一起去Tensorflow游乐场快乐地玩耍吧!
"李克强：中国大数据和云计算产业是开放的	",苏州高新区金融办,李克强在致辞中说，当今世界，信息化浪潮席卷全球，大数据、云计算、物联网等蓬勃发展，使互联网时代迈上一个新台阶。今天的中国要把握住世界科技革命的历史机遇，按照创新、协调、绿色、开放、共享的发展理念，加快创新型国家建设，着力推进结构性改革尤其是供给侧结构性改革，推动信息化与实体经济深度融合发展，不断提升全要素生产率，努力保持经济中高速增长、迈向中高端水平。
"全峰集团持续挖掘大数据	",快递物流网,李克强表示，要推动新经济发展和传统产业转型升级，必须坚持改革开放，使中国经济发展方式从过度依赖自然资源转向更多依靠人力资源开发。自然资源是有限的，但人力资源是无限的，蕴藏着无穷的创造力，是实现可持续发展的最大资源。我们坚持创新驱动发展战略，制定实施网络强国战略、国家大数据战略、“互联网+”行动计划、《中国制造2025》等，出台了一系列重大举措，在促进创新和更好发挥人力资源优势方面的效应正在显现。以大数据为代表的创新意识和传统产业长期孕育的工匠精神相结合，使新旧动能融合发展，并带动改造和提升传统产业，有力推动虚拟世界和现实世界融合发展，打造中国经济发展的“双引擎”。
数据分析基本思路及手法, 一样的月光,记者了解到，贵州理工学院作为贵州省首家免费使用正版SAS数据分析软件的高校，将利用SAS开展大数据专业人才培养以及电力大数据、大健康、智慧旅游等相关应用研究，搭建政产学研用平台，为贵州大数据产业发展提供有力平台支撑。
数据挖掘为什么要用R,经管之家论坛,随着云时代的来临，大数据技术具有重要的战略意义。而大数据分析作为数据存储和挖掘分析的前沿技术，广泛应用于物联网、云计算、移动互联网等战略性新兴产业。
"我国实物地质资料信息服务进入大数据时代	",云南延发矿业,安信证券在研报中分析，未来最有价值的资源是数据，两类公司值得关注：一是自身拥有数据的公司;二是为客户提供大数据分析、运营、服务的公司。
"大数据与数据挖掘	",航天惯性导航软件,大数据产业“十三五”规划年内落地几率大，为大数据产业送来政策暖风，将更好的促进大数据产业发展，而市场大数据概念股或将借势起飞，实现大涨，值得投资者重点关注。
"天阳科技成功案例分享，某城商行数据治理项目	",天阳科技,2月24日，创新层企业天阳科技拟申请终止挂牌，原因是为配合公司业务发展及长期战略发展规划的需要。而该公司早在2016年10月18日公告称，拟将注册地址变更到西藏拉萨市经济技术开发区。这也是证监会贫困地区IPO绿色通道中的地区之一。
大数据为社会善治打造智能化工具：金电联行公司推出大数据社会治理平台,数据猿,互联网时代，信息如浪潮般在社会中涌动，不仅给社会治理增添了干扰和难度，也给政府治理、决策提供了新视角、新手段。
